{
  "$schema": "https://json-schema.org/draft/2020-12/schema",
  "type": "object",
  "properties": {
    "schemaVersion": {
      "const": 1
    },
    "exportId": {
      "type": "string",
      "maxLength": 100
    },
    "exportedAt": {
      "type": "string",
      "format": "date-time"
    },
    "sourceDatasetVersion": {
      "type": "string",
      "maxLength": 200
    },
    "profile": {
      "type": "object",
      "properties": {
        "id": {
          "type": "string",
          "maxLength": 100
        },
        "name": {
          "type": "string",
          "maxLength": 100
        }
      },
      "required": [
        "id",
        "name"
      ],
      "additionalProperties": false
    },
    "entries": {
      "type": "array",
      "items": {
        "type": "object",
        "properties": {
          "familyId": {
            "type": "string",
            "minLength": 1,
            "maxLength": 160,
            "pattern": "^[a-z0-9][a-z0-9:_-]*$"
          },
          "everCaught": {
            "type": "boolean"
          },
          "captures": {
            "type": "array",
            "items": {
              "type": "string",
              "enum": ["any", "splus", "rs"]
            },
            "maxItems": 2
          },
          "obtainedFormIds": {
            "type": "array",
            "items": {
              "type": "string",
              "minLength": 1,
              "maxLength": 160,
              "pattern": "^[a-z0-9][a-z0-9:_-]*$"
            },
            "maxItems": 8,
            "uniqueItems": true
          },
          "currentOwnedCount": {
            "anyOf": [
              {
                "type": "integer",
                "minimum": 0,
                "maximum": 10000
              },
              {
                "type": "null"
              }
            ]
          },
          "favorite": {
            "type": "boolean"
          },
          "note": {
            "type": "string",
            "maxLength": 2000
          },
          "updatedAt": {
            "type": "string",
            "format": "date-time"
          },
          "localRevision": {
            "type": "integer",
            "minimum": 1,
            "maximum": 100000
          },
          "deletedAt": {
            "anyOf": [
              {
                "type": "string",
                "format": "date-time"
              },
              {
                "type": "null"
              }
            ]
          }
        },
        "required": [
          "familyId",
          "everCaught",
          "obtainedFormIds",
          "currentOwnedCount",
          "favorite",
          "note",
          "updatedAt",
          "localRevision",
          "deletedAt"
        ],
        "additionalProperties": false
      },
      "maxItems": 10000
    },
    "collectionClaims": {
      "type": "array",
      "items": {
        "type": "object",
        "properties": {
          "collectionId": {
            "type": "string",
            "minLength": 1,
            "maxLength": 160,
            "pattern": "^[a-z0-9][a-z0-9:_-]*$"
          },
          "rewardClaimed": {
            "type": "boolean"
          },
          "updatedAt": {
            "type": "string",
            "format": "date-time"
          }
        },
        "required": [
          "collectionId",
          "rewardClaimed",
          "updatedAt"
        ],
        "additionalProperties": false
      },
      "maxItems": 1000
    },
    "presets": {
      "type": "array",
      "items": {
        "type": "object",
        "properties": {
          "id": {
            "type": "string",
            "maxLength": 100
          },
          "familyId": {
            "type": "string",
            "minLength": 1,
            "maxLength": 160,
            "pattern": "^[a-z0-9][a-z0-9:_-]*$"
          },
          "level": {
            "type": "integer",
            "minimum": 1,
            "maximum": 35
          },
          "colors": {
            "type": "object",
            "properties": {
              "hp": {
                "enum": [
                  "red",
                  "white",
                  "green"
                ]
              },
              "spd": {
                "enum": [
                  "red",
                  "white",
                  "green"
                ]
              },
              "ea": {
                "enum": [
                  "red",
                  "white",
                  "green"
                ]
              },
              "pa": {
                "enum": [
                  "red",
                  "white",
                  "green"
                ]
              },
              "ed": {
                "enum": [
                  "red",
                  "white",
                  "green"
                ]
              },
              "pd": {
                "enum": [
                  "red",
                  "white",
                  "green"
                ]
              }
            },
            "required": [
              "hp",
              "spd",
              "ea",
              "pa",
              "ed",
              "pd"
            ],
            "additionalProperties": false
          },
          "bonuses": {
            "type": "object",
            "properties": {
              "hp": {
                "type": "integer",
                "minimum": 0,
                "maximum": 136
              },
              "spd": {
                "type": "integer",
                "minimum": 0,
                "maximum": 136
              },
              "ea": {
                "type": "integer",
                "minimum": 0,
                "maximum": 136
              },
              "pa": {
                "type": "integer",
                "minimum": 0,
                "maximum": 136
              },
              "ed": {
                "type": "integer",
                "minimum": 0,
                "maximum": 136
              },
              "pd": {
                "type": "integer",
                "minimum": 0,
                "maximum": 136
              }
            },
            "required": [
              "hp",
              "spd",
              "ea",
              "pa",
              "ed",
              "pd"
            ],
            "additionalProperties": false
          },
          "relicIds": {
            "type": "array",
            "items": {
              "anyOf": [
                {
                  "type": "string",
                  "minLength": 1,
                  "maxLength": 160,
                  "pattern": "^[a-z0-9][a-z0-9:_-]*$"
                },
                {
                  "type": "null"
                }
              ]
            },
            "maxItems": 4
          },
          "datasetVersion": {
            "type": "string",
            "maxLength": 200
          },
          "rulesVersion": {
            "type": "string",
            "maxLength": 200
          },
          "label": {
            "type": "string",
            "maxLength": 100
          }
        },
        "required": [
          "id",
          "familyId",
          "level",
          "colors",
          "bonuses",
          "relicIds",
          "datasetVersion",
          "rulesVersion",
          "label"
        ],
        "additionalProperties": false
      },
      "maxItems": 1000
    }
  },
  "required": [
    "schemaVersion",
    "exportId",
    "exportedAt",
    "sourceDatasetVersion",
    "profile",
    "entries",
    "collectionClaims",
    "presets"
  ],
  "additionalProperties": false
}
